{
  "cohortKey": "bbbbbbbbbbbbbbbbbbbbbbbbbbbbbbbbbbbbbbbbbbbbbbbbbbbbbbbbbbbbbbbb",
  "entries": [
    {
      "backupDigest": "aaaaaaaaaaaaaaaaaaaaaaaaaaaaaaaaaaaaaaaaaaaaaaaaaaaaaaaaaaaaaaaa",
      "backupId": "bk-old",
      "eligible": true
    }
  ],
  "kind": "BackupMetadataGcEntryManifest",
  "planDigest": "cccccccccccccccccccccccccccccccccccccccccccccccccccccccccccccccc",
  "pluginId": "go-orca",
  "schemaVersion": 1
}
