{
  "cohortKey": "bbbbbbbbbbbbbbbbbbbbbbbbbbbbbbbbbbbbbbbbbbbbbbbbbbbbbbbbbbbbbbbb",
  "entries": [
    {
      "backupDigest": "aaaaaaaaaaaaaaaaaaaaaaaaaaaaaaaaaaaaaaaaaaaaaaaaaaaaaaaaaaaaaaaa",
      "backupId": "bk-1",
      "bytes": 1024,
      "createdAt": "2026-08-03T00:00:00.000Z"
    }
  ],
  "kind": "BackupListResult",
  "nextPageToken": null,
  "pageSize": 18,
  "pluginId": "go-orca",
  "revision": 1,
  "schemaVersion": 1
}
