{
  "backupDigest": "aaaaaaaaaaaaaaaaaaaaaaaaaaaaaaaaaaaaaaaaaaaaaaaaaaaaaaaaaaaaaaaa",
  "backupId": "bk-1",
  "cohortKey": "bbbbbbbbbbbbbbbbbbbbbbbbbbbbbbbbbbbbbbbbbbbbbbbbbbbbbbbbbbbbbbbb",
  "kind": "BackupDeleteArmed",
  "planDigest": "cccccccccccccccccccccccccccccccccccccccccccccccccccccccccccccccc",
  "pluginId": "go-orca",
  "schemaVersion": 1,
  "writer": "Host"
}
